Unnamed: 0,번호,제목,저자,출판사,출판일
,1,Improved big data stock index prediction using deep learning with CNN and GRU,"Eapen, Jithin; Verma, Abhishek; Bein, Doina",Inderscience,2021
,2,"Health big data analytics: current perspectives, challenges and potential solutions","Kuo, Mu-Hsing; Sahama, Tony; Kushniruk, Andre W.; Borycki, Elizabeth M.; Grunwell, Daniel K.",Inderscience,2014
,3,Agile Big Data Analytics for Web-Based Systems: An Architecture-Centric Approach,"Chen, H.; Kazman, R.; Haziyev, S.",unknown,2016
,4,Guest Editorial: Big Data Analytics and the Web,"Sheng, M.; Vasilakos, A. V.; Yu, Q.; You, L.",unknown,2016
,5,Guest Editorial: Big Data Infrastructure I,"Chen, J.; Wang, H.",unknown,2018
,6,Guest Editorial: Big Data Analytics and the Web,"Sheng, Q. Z.; Vasilakos, A. V.; Yu, Q.; Yao, L.",unknown,2015
,7,Guest Editorial: Big Scholar Data Discovery and Collaboration,"Lin, Y.; Tong, H.; Tang, J.; Candan, K. S.",unknown,2016
,8,Guest Editorial: Big Scholar Data Discovery and Collaboration,"Lin, Y.; Tong, H.; Tang, J.; Candan, K. S.",unknown,2017
,9,Speed Up Big Data Analytics by Unveiling the Storage Distribution of Sub-Datasets,"Wang, J.; Zhang, X.; Yin, J.; Wang, R.; Wu, H.; Han, D.",unknown,2018
,10,Resting-State fMRI Functional Connectivity: Big Data Preprocessing Pipelines and Topological Data Analysis,"Phinyomark, A.; Ibanez-Marcelo, E.; Petri, G.",unknown,2017
,11,Kvasir: Scalable Provision of Semantically Relevant Web Content on Big Data Framework,"Wang, L.; Tasoulis, S.; Roos, T.; Kangasharju, J.",unknown,2016
,12,Thermal-Aware and DVFS-Enabled Big Data Task Scheduling for Data Centers,"Liu, H.; Liu, B.; Yang, L. T.; Lin, M.; Deng, Y.; Bilal, K.; Khan, S. U.",unknown,2018
,13,A survey and development on context-aware monitoring in healthcare with big data,"Reeja, S.R.; Baig, Murthuza Ali; Cherian, Rino; Jothimani, K.",Inderscience,2020
,14,Optimized Deep Learning for EEG Big Data and Seizure Prediction BCI via Internet of Things,"Hosseini, M.; Pompili, D.; Elisevich, K.; Soltanian-Zadeh, H.",unknown,2017
,15,Hybridisation of classifiers for anomaly detection in big data,"Alguliyev, Rasim M.; Aliguliyev, Ramiz M.; Abdullayeva, Fargana Jabbar",Inderscience,2019
,16,A five-layer architecture for big data processing and analytics,"Zhu, Julie Yixuan; Tang, Bo; Li, Victor O.K.",Inderscience,2019
,17,Fast approaches for semantic service composition in big data environment,"Huang, Jun; Zhou, Yide; Duan, Qiang; Xing, Cong-Cong",Inderscience,2019
,18,Fuzzy Based Scalable Clustering Algorithms for Handling Big Data Using Apache Spark,"Bharill, N.; Tiwari, A.; Malviya, A.",unknown,2016
,19,Towards a real-time big data analytics platform for health applications,"Chrimes, Dillon; Kuo, Mu-Hsing; Moa, Belaid; Hu, Wei",Inderscience,2017
,20,Parallel computing for preserving privacy using k-anonymisation algorithms from big data,"Yaji, Sharath; Neelima, B.",Inderscience,2018
,21,Towards quality-of-service driven consistency for Big Data management,"García-Recuero, Álvaro; Esteves, Sérgio; Veiga, Luís",Inderscience,2014
,22,A survey on big data processing infrastructure: evolving role of FPGA,"Nunna, Krishna Chaitanya; Mehdipour, Farhad; Trouvé, Antoine; Murakami, Kazuaki J.",Inderscience,2015
,23,Classification and comparison of NoSQL big data models,"Sharma, Sugam; Tim, Udoyara Sunday; Gadia, Shashi; Wong, Johnny; Shandilya, Ritu; Peddoju, Sateesh K.",Inderscience,2015
,24,Current trends in predictive analytics of big data,"Wlodarczyk, Tomasz Wiktor; Hacker, Thomas J.",Inderscience,2014
,25,Towards Max-Min Fair Resource Allocation for Stream Big Data Analytics in Shared Clouds,"Jiang, Y.; Huang, Z.; Tsang, D. H.",unknown,2018
,26,Towards quality-of-service driven consistency for Big Data management,"García-Recuero, Álvaro; Esteves, Sérgio; Veiga, Luís",Inderscience,2014
,27,Availability modelling and assurance for a big data computing,"Ke, Zuqiang; Park, Nohpill",Inderscience,2019
,28,A reference architecture for big data solutions - introducing a model to perform predictive analytics using big data technology,"Geerdink, Bas",Inderscience,2015
,29,A Hierarchical Distributed Processing Framework for Big Image Data,"Dong, L.; Lin, Z.; Liang, Y.; He, L.; Zhang, N.; Chen, Q.; Cao, X.; Izquierdo, E.",unknown,2016
,30,2017 Index IEEE Transactions on Big Data Vol. 3,unknown,unknown,2018
,31,Online Similarity Learning for Big Data with Overfitting,"Cong, Y.; Liu, J.; Fan, B.; Zeng, P.; Yu, H.; Luo, J.",unknown,2018
,32,Large-scale spectral clustering for managing big data in healthcare operations,"Liu, Maoqing; Fard, Nasser; Sadeghzadeh, Keivan",Inderscience,2017
,33,NoSQL databases for big data,"Oussous, Ahmed; Benjelloun, Fatima-Zahra; Lahcen, Ayoub Ait; Belfkih, Samir",Inderscience,2017
,34,PaloPro: a platform for knowledge extraction from big social data and the news,"Makrynioti, Nantia; Grivas, Andreas; Sardianos, Christos; Tsirakis, Nikos; Varlamis, Iraklis; Vassalos, Vasilis; Poulopoulos, Vassilis; Tsantilas, Panagiotis",Inderscience,2017
,35,Secure multi-owner-based cloud computing scheme for big data,"Al-Shablan, Maram; Tian, Yuan; Al-Rodhaan, Mznah",Inderscience,2016
,36,AlgorithmSeer: A System for Extracting and Searching for Algorithms in Scholarly Big Data,"Tuarob, S.; Bhatia, S.; Mitra, P.; Giles, C. L.",unknown,2016
,37,An Extended Spatio-Temporal Granger Causality Model for Air Quality Estimation with Heterogeneous Urban Big Data,"Zhu, J. Y.; Sun, C.; Li, V. O.",unknown,2017
,38,Taxi-Passenger-Demand Modeling Based on Big Data from a Roving Sensor Network,"Zhang, D.; He, T.; Lin, S.; Munir, S.; Stankovic, J. A.",unknown,2017
,39,Corporate governance fraud detection from annual reports using big data analytics,"Sadasivam, G. Sudha; Subrahmanyam, Mutyala; Himachalam, Dasaraju; Pinnamaneni, Bhanu Prasad; Lakshme, S. Maha",Inderscience,2016
,40,A review on ethical concerns in big data management,"Nair, Suja R.",Inderscience,2020
,41,Perceptions of independent financial advisors on the usefulness of big data in the context of decision making in the UK,"Grishikashvili, Ketty; Bechter, Clemens",Inderscience,2019
,42,An Enhanced Visualization Method to Aid Behavioral Trajectory Pattern Recognition Infrastructure for Big Longitudinal Data,"Fang, H.; Zhang, Z.",unknown,2018
,43,Smart Monitoring Cameras Driven Intelligent Processing to Big Surveillance Video Data,"Shao, Z.; Cai, J.; Wang, Z.",unknown,2018
,44,Toward Efficient and Flexible Metadata Indexing of Big Data Systems,"Zhao, D.; Qiao, K.; Zhou, Z.; Li, T.; Lu, Z.; Xu, X.",unknown,2017
,45,2016 Index IEEE Transactions on Big Data Vol. 2,unknown,unknown,2017
,46,A platform for big data analytics on distributed scaleout storage system,"Aye, Kyar Nyo; Thein, Thandar",Inderscience,2015
,47,A platform for big data analytics on distributed scale-out storage system,"Aye, Kyar Nyo; Thein, Thandar",Inderscience,2015
,48,HDM: A Composable Framework for Big Data Processing,"Wu, D.; Zhu, L.; Lu, Q.; Sakr, S.",unknown,2018
,49,Distributed Feature Selection for Efficient Economic Big Data Analysis,"Zhao, L.; Chen, Z.; Hu, Y.; Min, G.; Jiang, Z.",unknown,2018
,50,Structural Balance Theory-Based E-Commerce Recommendation over Big Rating Data,"Qi, L.; Xu, X.; Zhang, X.; Dou, W.; Hu, C.; Zhou, Y.; Yu, J.",unknown,2018
,51,DiP-SVM : Distribution Preserving Kernel Support Vector Machine for Big Data,"Singh, D.; Roy, D.; Mohan, C. K.",unknown,2017
,52,A concentric framework for leveraging big data for business value,"Chuang, Ta-Tao; Nakatani, Kazuo; Patil, Vivek H.",Inderscience,2020
,53,Petuum: A New Platform for Distributed Machine Learning on Big Data,"Xing, E. P.; Ho, Q.; Dai, W.; Kim, J. K.; Wei, J.; Lee, S.; Zheng, X.; Xie, P.; Kumar, A.; Yu, Y.",unknown,2015
,54,Deduplication on Encrypted Big Data in Cloud,"Yan, Z.; Ding, W.; Yu, X.; Zhu, H.; Deng, R. H.",unknown,2016
,55,Guest Editorial: Special Issue on Big Scholar Data Discovery and Collaboration (Continued),"Lin, Y.; Tong, H.; Tang, J.; Selcuk Candan, K.",unknown,2016
,56,Big Earth Data: a comprehensive analysis of visualization analytics issues,"Merritt, Patrick; Bi, Haixia; Davis, Bradley; Windmill, Christopher; Xue, Yong",John Wiley & Sons Ltd,2018
,57,GSio: A programmatic interface for delivering Big Earth data-as-a-service,"Larraondo, Pablo R.; Pringle, Sean; Guo, Jian; Antony, Joseph; Evans, Ben",John Wiley & Sons Ltd,2017
,58,A view-based model of data-cube to support big earth data systems interoperability,"Nativi, Stefano; Mazzetti, Paolo; Craglia, Max",John Wiley & Sons Ltd,2017
,59,Big Earth data: A new frontier in Earth and information sciences,"Guo, Huadong",John Wiley & Sons Ltd,2017
,60,Exploiting big earth data from space – first experiences with the timescan processing chain,"Esch, T.; Üreyen, S.; Zeidler, J.; Metz–Marconcini, A.; Hirner, A.; Asamer, H.; Tum, M.; Böttcher, M.; Kuchar, S.; Svaton, V.; Marconcini, M.",John Wiley & Sons Ltd,2018
,61,Big spatial vector data management: a review,"Yao, Xiaochuang; Li, Guoqing",John Wiley & Sons Ltd,2018
,62,The role of big Earth data in understanding climate change,"Jia, Gensuo",John Wiley & Sons Ltd,2020
,63,Semantics all the way down: the Semantic Web and open science in big earth data,"Narock, Tom; Shepherd, Adam",John Wiley & Sons Ltd,2017
,64,Innovative approaches to the Sustainable Development Goals using Big Earth Data,"Guo, Huadong; Liang, Dong; Chen, Fang; Shirazi, Zeeshan",John Wiley & Sons Ltd,2021
,65,A generalized supervised classification scheme to produce provincial wetland inventory maps: an application of Google Earth Engine for big geo data processing,"Amani, Meisam; Brisco, Brian; Afshar, Majid; Mirmazloumi, S. Mohammad; Mahdavi, Sahel; Mirzadeh, Sayyed Mohammad Javad; Huang, Weimin; Granger, Jean",John Wiley & Sons Ltd,2019
,66,Big Earth data facilitates sustainable development goals,"Guo, Huadong",John Wiley & Sons Ltd,2020
,67,"Geospatial semantics, ontology and knowledge graphs for Big Earth data","Zhu, Yunqiang",John Wiley & Sons Ltd,2019
,68,Big Earth data analytics: a survey,"Yang, Chaowei; Yu, Manzhu; Li, Yun; Hu, Fei; Jiang, Yongyao; Liu, Qian; Sha, Dexuan; Xu, Mengchao; Gu, Juan",John Wiley & Sons Ltd,2019
,69,Efficient utilization of multi-core processors and many-core co-processors on supercomputer beacon for scalable geocomputation and geo-simulation over big earth data,"Lai, Chenggang; Shi, Xuan; Huang, Miaoqing",John Wiley & Sons Ltd,2018
,70,Analytics of big geosocial media and crowdsourced data,"Li, Songnian; Wachowicz, Monica; Fan, Hongchao",John Wiley & Sons Ltd,2021
,71,Stewardship and analysis of big Earth observation data,"Wang, Lizhe; Yan, Jining",John Wiley & Sons Ltd,2020
,72,"The visual analytics of big, open public transport data – a framework and pipeline for monitoring system performance in Greater Sydney","Lock, Oliver; Bednarz, Tomasz; Pettit, Christopher",John Wiley & Sons Ltd,2021
,73,Big earth data analytics on Sentinel-1 and Landsat imagery in support to global human settlements mapping,"Corbane, Christina; Pesaresi, Martino; Politis, Panagiotis; Syrris, Vasileios; Florczyk, Aneta J.; Soille, Pierre; Maffenini, Luca; Burger, Armin; Vasilev, Veselin; Rodriguez, Dario; Sabo, Filip; Dijkstra, Lewis; Kemper, Thomas",John Wiley & Sons Ltd,2017
,74,A review on sentiment discovery and analysis of educational big‐data,"Han, Zhongmei; Wu, Jiyi; Huang, Changqin; Huang, Qionghao; Zhao, Meihua",John Wiley & Sons Ltd,2020
,75,SIMD parallel MCMC sampling with applications for big-data Bayesian analytics,"Mahani, A. S.; Sharabiani, M. T.","Elsevier Science B.V., Amsterdam.",2015
,76,Big data analytics—A review of data‐mining models for small and medium enterprises in the transportation sector,"Mohd Selamat, Siti Aishah; Prakoonwit, Simant; Sahandi, Reza; Khan, Wajid; Ramachandran, Manoharan",John Wiley & Sons Ltd,2018
,77,Data analysis on big data: improving the map and shuffle phases in Hadoop Map Reduce,"Lakshmi, J.V.N.",Inderscience,2018
,78,"Big, Bigger, Biggest: Data repositories balloon to unprecedented levels. Coping with ``Big Data.''",unknown,SOURCE MEDIA INC.,2013
,79,Big data analytics—a review of data‐mining models for small and medium enterprises in the transportation sector,"Mohd Selamat, Siti Aishah; Prakoonwit, Simant; Sahandi, Reza; Khan, Wajid; Ramachandran, Manoharan",John Wiley & Sons Ltd,2018
,80,Transforming big data into smart data: An insight on the use of the k‐nearest neighbors algorithm to obtain quality data,"Triguero, Isaac; García‐Gil, Diego; Maillo, Jesús; Luengo, Julián; García, Salvador; Herrera, Francisco",John Wiley & Sons Ltd,2019
,81,Forecasting with Big Data: A Review,"Hassani, H.; Silva, E. S.",Springer Science + Business Media,2015
,82,"Semantics Meets Big Data: Formal Models, Practical Issues, Novel Paradigms","Cuzzocrea, A.",Springer,2016
,83,Quantile regression in big data: A divide and conquer based strategy,"Chen, Lanjue; Zhou, Yong","Elsevier Science B.V., Amsterdam.",2020
,84,How organisations leverage Big Data: a maturity model,"Comuzzi, Marco; Patel, Anit",Emerald Group Publishing Limited,2016
,85,Visualization and statistical modeling of financial big data: double-log modeling with skew-symmetric error distributions,"Jimichi, Masayuki; Miyamoto, Daisuke; Saka, Chika; Nagata, Shuichi",Springer Nature,2018
,86,"Big data, big results: Knowledge discovery in output from large?scale analytics","McCormick, T.H.; Ferrell, R.; Karr, A.F.; Ryan, P.B.","John Wiley & Sons, Ltd",2014
,87,Data Mining with Big Data,"Xindong, W.; Xingquan, Z.; Gong-Qing, W.; Wei, D.",IEEE INSTITUTE OF ELECTRICAL AND ELECTRONICS,2014
,88,Big Data Challenges in Big Science,"Heiss, Andreas",Springer Nature,2019
,89,Big Data doesn't always yield big benefits,unknown,SOURCE MEDIA INC.,2015
,90,Big Data technologies to process spatial and attribute data when designing and operating mine-engineering systems,"Stepanov, Yuri A.; Stepanov, Alexander V.",Taylor & Francis,2019
,91,Data discretization: taxonomy and big data challenge,"Ramírez‐Gallego, Sergio; García, Salvador; Mouriño‐Talín, Héctor; Martínez‐Rego, David; Bolón‐Canedo, Verónica; Alonso‐Betanzos, Amparo; Benítez, José Manuel; Herrera, Francisco",John Wiley & Sons Ltd,2016
,92,Spatial Data Mining: A Perspective of Big Data,Shuliang Wang; Hanning Yuan,Idea Group Pub,2014
,93,Using data to build a better EM: EM* for big data,"Kurban, H.; Jenne, M.; Dalkilic, M. M.",Springer Science + Business Media,2017
,94,From big data to big analysis: a perspective of geographical conditions monitoring,"Zhai, Liang; Zhang, Na; Hou, Wei; Feng, Zhixian; Qiao, Qinghua; Luo, Minghai",Taylor & Francis,2018
,95,Automated Data Slicing for Model Validation: A Big Data - AI Integration Approach,"Chung, Yeounoh; Kraska, Tim; Polyzotis, Neoklis; Tae, Ki Hyun; Whang, Steven Euijong",IEEE INSTITUTE OF ELECTRICAL AND ELECTRONICS,2020
,96,A Detailed Review on the Prominent Compression Methods Used for Reducing the Data Volume of Big Data,"Anuradha, D.; Bhuvaneswari, S.",Springer Science + Business Media,2016
,97,Divide and recombine (D&R) data science projects for deep analysis of big data and high computational complexity,"Tung, Wen-wen; Barthur, Ashrith; Bowers, Matthew C.; Song, Yuying; Gerth, John; Cleveland, William S.",Springer Nature,2018
,98,An overview of online based platforms for sharing and analyzing electrophysiology data from big data perspective,"Chen, Yang; Wang, Zhong‐yi; Yuan, Gang; Huang, Lan",John Wiley & Sons Ltd,2017
,99,A Survey on Data Collection for Machine Learning: A Big Data - AI Integration Perspective,"Roh, Yuji; Heo, Geon; Whang, Steven Euijong",IEEE INSTITUTE OF ELECTRICAL AND ELECTRONICS,2021
,100,The Gamma Matrix to Summarize Dense and Sparse Data Sets for Big Data Analytics,"Ordonez, C.; Zhang, Y.; Cabrera, W.",IEEE INSTITUTE OF ELECTRICAL AND ELECTRONICS,2016
,1,Haery: A Hadoop Based Query System on Accumulative and High-Dimensional Data Model for Big Data,"Song, Jie; He, Hongyan; Thomas, Richard; Bao, Yubin; Yu, Ge",IEEE INSTITUTE OF ELECTRICAL AND ELECTRONICS,2020
,2,Chicken swarm foraging algorithm for big data classification using the deep belief network classifier,"R, Sathyaraj; L, Ramanathan; K, Lavanya; V, Balasubramanian; J, Saira Banu",Emerald Publishing,2020
,3,Big data analytics in single‐cell transcriptomics: Five grand opportunities,"Bhattacharya, Namrata; Nelson, Colleen C.; Ahuja, Gaurav; Sengupta, Debarka",John Wiley & Sons Ltd,2021
,4,Big data analytics with swarm intelligence,"Cheng, Shi; Zhang, Qingyu; Qin, Quande",Emerald Group Publishing Limited,2016
,5,Big Data Paradigm: What is the Status of Privacy and Security?,"Strang, K. D.; Sun, Z.",Springer Science + Business Media,2017
,6,Big Data Improves Care,unknown,SOURCE MEDIA INC.,2015
,7,An analysis of academic librarians competencies and skills for implementation of Big Data analytics in libraries,"Ahmad, Khurshid; JianMing, Zheng; Rafi, Muhammad",Emerald Publishing,2019
,8,Entity deduplication in big data graphs for scholarly communication,"Manghi, Paolo; Atzori, Claudio; De Bonis, Michele; Bardi, Alessia",Emerald Publishing,2020
,9,Special issue: First International Conference on Big Data and Smart Computing (BigComp2014),"Kim, J.; Kwok, J.; Sumiya, K.; Zhang, B. T.","Elsevier Science B.V., Amsterdam.",2016
,10,Big data analytics for security and criminal investigations,"Pramanik, M.I.; Lau, Raymond Y.K.; Yue, Wei T.; Ye, Yunming; Li, Chunping",John Wiley & Sons Ltd,2017
,11,Big data processing tools: An experimental performance evaluation,"Rodrigues, Mário; Santos, Maribel Yasmina; Bernardino, Jorge",John Wiley & Sons Ltd,2019
,12,BIG DATA and fusion,"Zhang, Jixian",Taylor & Francis,2015
,13,"Big Data, the Internet of Things, and the Revised Knowledge Pyramid","Jennex,  Murray E.",ACM SIGMIS,2017
,14,Big data analytics on Apache Spark,"Salloum, S.; Dautov, R.; Chen, X.; Peng, P. X.; Huang, J. Z.",Springer Science + Business Media,2016
,15,Big data analytics – enabled cyber-physical system: model and applications,"Luo, Shuai; Liu, Hongwei; Qi, Ershi",Emerald Group Publishing Limited,2019
,16,Big data analytics: Machine learning and Bayesian learning perspectives—What is done? What is not?,"Suthaharan, Shan",John Wiley & Sons Ltd,2019
,17,"Big data with cloud computing: an insight on the computing environment, mapreduce, and programming frameworks","Fernández, Alberto; del Río, Sara; López, Victoria; Bawakid, Abdullah; del Jesus, María J.; Benítez, José M.; Herrera, Francisco",John Wiley & Sons Ltd,2014
,18,Applying big data analytics to support Kansei engineering for hotel service development,"Chen, Mu-Chen; Hsiao, Yu-Hsiang; Chang, Kuo-Chien; Lin, Ming-Ke",Emerald Publishing,2019
,19,Quality Assessment of Peer-Produced Content in Knowledge Repositories Using Big Data and Social Networks: The Case of Implicit Collaboration in Wikipedia,"Velichety, Srikar",ACM SIGMIS,2019
,20,Exploring Big Data Analysis: Fundamental Scientific Problems,"Xu, Z.; Shi, Y.",Springer Science + Business Media,2015
,21,Practical Big Data,unknown,SOURCE MEDIA INC.,2014
,22,Tensor-Based Big Data Management Scheme for Dimensionality Reduction Problem in Smart Grid Systems: SDN Perspective,"Kaur, D.; Aujla, G. S.; Kumar, N.; Zomaya, A. Y.; Perera, C.; Ranjan, R.",IEEE INSTITUTE OF ELECTRICAL AND ELECTRONICS,2018
,23,In-Memory Big Data Management and Processing: A Survey,"Hao, Z.; Gang, C.; Beng, C. O.; Kian-Lee, T.; Meihui, Z.",IEEE INSTITUTE OF ELECTRICAL AND ELECTRONICS,2015
,24,"Michael Buck talks about living his dream of being a bioinformaticist, and the emerging alternatives to big data warehouses",unknown,SOURCE MEDIA INC.,2012
,25,Managing big data in coal-fired power plants: a business intelligence framework,"Chongwatpol, Jongsawas",Emerald Group Publishing Limited,2016
,26,Analytics Partners Allina Health teams up with Health Catalyst to garner the benefits of big data,unknown,SOURCE MEDIA INC.,2016
,27,Semantics-Aware Approaches to Big Data Engineering,"Cuzzocrea, A.; Sellis, T.",Springer,2017
,28,Cell phone big data to compute mobility scenarios for future smart cities,"Tosi, D.",Springer Science + Business Media,2017
,29,Smart city big data analytics: An advanced review,"Soomro, Kamran; Bhutta, Muhammad Nasir Mumtaz; Khan, Zaheer; Tahir, Muhammad A.",John Wiley & Sons Ltd,2019
,30,How China Deals with Big Data,"Shi, Y.; Shan, Z.; Li, J.; Fang, Y.",Springer Science + Business Media,2017
,31,MongoDB-Based Modular Ontology Building for Big Data Integration,"Abbes, H.; Gargouri, F.",Springer,2018
,32,Fuzzy rule based classification systems for big data with MapReduce: granularity analysis,"Fernández, A.; Río, S.; Bawakid, A.; Herrera, F.",Springer Science + Business Media,2017
,33,Flexible Heavy Tailed Distributions for Big Data,"Zhang, Y.; Nadarajah, S.",Springer Science + Business Media,2017
,34,Supervised compression of big data,"Joseph, V. Roshan; Mak, Simon","John Wiley & Sons, Ltd",2021
,35,A watchdog approach - name-matching algorithm for big data risk intelligence,"Kirubakaran, Anusuya; Aramudhan, M.",Inderscience,2018
,36,Bayesian consensus clustering with LIME for security in big data,"Balamurugan, S.; Thangaraj, M.",Inderscience,2021
,37,Distributed subdata selection for big data via sampling-based approach,"Zhang, Haixiang; Wang, HaiYing","Elsevier Science B.V., Amsterdam.",2021
,38,Barriers of embedding big data solutions in smart factories: insights from SAP consultants,"Li, Shuyang; Peng, Guo Chao; Xing, Fei",Emerald Group Publishing Limited,2019
,39,Predicting the ratings of Amazon products using Big Data,"Woo, Jongwook; Mishra, Monika",John Wiley & Sons Ltd,2021
,40,An intelligent approach to Big Data analytics for sustainable retail environment using Apriori-MapReduce framework,"Verma, Neha; Singh, Jatinder",Emerald Group Publishing Limited,2017
,41,Incremental Query Processing on Big Data Streams,"Fegaras, L.",IEEE INSTITUTE OF ELECTRICAL AND ELECTRONICS,2016
,42,Application of hyper-convergent platform for big data in exploring regional innovation systems,"Finogeev, Alexey G.; Gamidullaeva, Leyla A.; Vasin, Sergey M.",Inderscience,2020
,43,Stakeholder Perceptions and Word-of-Mouth on CSR Dynamics: A Big Data Analysis from Twitter,Andrée Marie López-Fernández; Zamira Burgos Silva,"Idea Group Pub.,",2018
,44,An insight into application of big data analytics in healthcare,"Nalluri, Sravani; Sasikala, R.",Inderscience,2020
,45,MR plot: A big data tool for distinguishing distributions,"Ardakani, Omid M.; Asadi, Majid; Ebrahimi, Nader; Soofi, Ehsan S.","John Wiley & Sons, Ltd",2020
,46,A Holistic View of Big Data,Won Kim; Ok-Ran Jeong; Chulyun Kim,Idea Group Pub,2014
,47,Modeling and Evaluating the Effects of Big Data Storage Resource Allocation in Global Scale Cloud Architectures,Enrico Barbierato; Marco Gribaudo; Mauro Iacono,Idea Group Pub,2016
,48,Efficient Skyline Computation on Big Data,"Xixian, H.; Jianzhong, L.; Donghua, Y.; Jinbao, W.",IEEE INSTITUTE OF ELECTRICAL AND ELECTRONICS,2013
,49,A Framework for Evaluating Design Methodologies for Big Data Warehouses: Measurement of the Design Process,Francesco Di Tria; Ezio Lefons; Filippo Tangorra,Idea Group Pub,2018
,50,Online updating method to correct for measurement error in big data streams,"Lee, JooChul; Wang, HaiYing; Schifano, Elizabeth D.","Elsevier Science B.V., Amsterdam.",2020
,51,Unlocking causal relations of barriers to big data analytics in manufacturing firms,"Raut, Rakesh; Narwane, Vaibhav; Kumar Mangla, Sachin; Yadav, Vinay Surendra; Narkhede, Balkrishna Eknath; Luthra, Sunil",Emerald Group Publishing Limited,2021
,52,Scalable machine‐learning algorithms for big data analytics: a comprehensive review,"Gupta, Preeti; Sharma, Arun; Jindal, Rajni",John Wiley & Sons Ltd,2016
,53,Analysing repeat blood donation behavior via big data,"Chen, Xu; Liu, Lei; Guo, Xinyu",Emerald Group Publishing Limited,2020
,54,Comparing world regional sustainable supply chain finance using big data analytics: a bibliometric analysis,"Tseng, Ming-Lang; Bui, Tat-Dat; Lim, Ming K.; Tsai, Feng Ming; Tan, Raymond R.",Emerald Group Publishing Limited,2021
,55,Advancing science and technology with big data analytics,"Li, Jia","John Wiley & Sons, Ltd",2018
,56,VA-Store: A Virtual Approximate Store Approach to Supporting Repetitive Big Data in Genome Sequence Analyses,unknown,IEEE INSTITUTE OF ELECTRICAL AND ELECTRONICS,2020
,57,A Novel Pipeline Approach for Efficient Big Data Broadcasting,"Wu, C.; Ku, C.; Ho, J.; Chen, M.",IEEE INSTITUTE OF ELECTRICAL AND ELECTRONICS,2016
,58,Bias Correction in a Small Sample from Big Data,"Jianguo, L.; Dingding, L.",IEEE INSTITUTE OF ELECTRICAL AND ELECTRONICS,2013
,59,i$^2$ MapReduce: Incremental MapReduce for Mining Evolving Big Data,"Yanfeng, Z.; Shimin, C.; Qiang, W.; Ge, Y.",IEEE INSTITUTE OF ELECTRICAL AND ELECTRONICS,2015
,60,A Semi-Automatic Design Methodology for (Big) Data Warehouse Transforming Facts into Dimensions,"Sautot, Lucile; Bimonte, Sandro; Journaux, Ludovic",IEEE INSTITUTE OF ELECTRICAL AND ELECTRONICS,2020
,61,A Privacy-Preserving Distributed Contextual Federated Online Learning Framework with Big Data Support in Social Recommender Systems,"Zhou, Pan; Wang, Kehao; Guo, Linke; Gong, Shimin; Zheng, Bolong",IEEE INSTITUTE OF ELECTRICAL AND ELECTRONICS,2021
,62,On the Feasibility of Distributed Kernel Regression for Big Data,"Xu, Chen; Zhang, Yongquan; Li, Runze; Wu, Xindong",IEEE INSTITUTE OF ELECTRICAL AND ELECTRONICS,2016
,63,Security and Privacy Implications on Database Systems in Big Data Era: A Survey,"Samaraweera, G. Dumindu; Chang, J. Morris",IEEE INSTITUTE OF ELECTRICAL AND ELECTRONICS,2020
