Unnamed: 0,번호,제목,저자,출판사,출판일
,46,"BIG DATA, BIGGER QUESTIONS: DATA-BASED BUSINESS MODELS AND THEIR IMPLICATIONS FOR ORGANIZATIONAL BOUNDARIES, DATA GOVERNANCE, AND SOCIETY","Shantz, Angelique Slade",Emerald,2018
,47,To mulch or to munch? Big modelling of big data,"Rodriguez, D; de Voil, P; Rufino, MC; Odendo, M; van Wijk, MT","Elsevier Science B.V., Amsterdam.",2017
,48,Demystifying big data: Anatomy of big data developmental process. Telecommunications Policy 40: 837-854,"Shin, D.-H.","Elsevier Science B.V., Amsterdam.",2020
,49,Think Big with Big Data: Identifying Suitable Big Data Strategies in Corporate Environments,"Ebner, K.; Buhnen, T.; Urbach, N.",IEEE,2014
,50,"A data-driven revolution The Internet of Things, big data, data analytics, and cloud computing can be used to create platform-independent advanced process control solutions to help industry optimize operations","Domínguez,  Luis; Kumar,  S. Mohan; Gallestey,  Eduardo; Saynevirta,  Simo",ISA INSTRUMENT SOCIETY OF AMERICA,2017
,51,WHAT DATA SAYS ABOUT US What are we learning from the vast ocean of data? Truths about our measured world and our measured selves. Excerpted from The Human Face of Big Data,"Smolan, R.; Erwitt, J.",TIME INC,2012
,52,Demystifying big data: Anatomy of big data developmental process,"Shin, Dong-Hee","Elsevier Science B.V., Amsterdam.",2016
,53,"A data-driven revolution The Internet of Things, big data, data analytics, and cloud computing can be used to create platform-independent advanced process control solutions to help industry optimize operations","Domínguez, Luis; Kumar, S. Mohan; Gallestey, Eduardo; Saynevirta, Simo",ISA INSTRUMENT SOCIETY OF AMERICA,2017
,54,"Cognitive big data: survey and review on big data research and its implications. What is really ""new"" in big data?","Lugmayr, Artur; Stockleben, Björn; Scheib, Christoph; Mailaparampil, Mathew A.",Emerald Group Publishing limited,2017
,55,From Big to Smart Data: Iterative ensemble filter for noise filtering in Big Data classification,"García‐Gil, Diego; Luque‐Sánchez, Francisco; Luengo, Julián; García, Salvador; Herrera, Francisco","John Wiley & Sons, Ltd",2019
,56,"Thinking Big Transitioning your students from working with small, student-collected data sets toward ``big data''","Kastens,  Kim; Krumhansl,  Ruth; Baker,  Irene",NATIONAL SCIENCE TEACHERS ASSOCIATION,2015
,57,Why ``Big Data'' Is a Big Deal New methods for understanding the torrent of data promise to save lives and propel scholarship,"Shaw, J.",HARVARD MAGAZINE INC.,2014
,58,"Imagining big data: Illustrations of “big data” in US news articles, 2010-2016",Christian Pentzold; Cornelia Brantner; Lena Fölsche,SAGE PUBLICATIONS LTD,2019
,59,"Editorial: Big Data and New Drug Discovery: Tackling ""Big Data"" for Virtual Screening of Large Compound Databases","C. Basak, Subhash; Vracko, Marjan; K. Bhattacharjee, Apurba",Bentham Science Publishers Ltd,2015
,60,Reining in Big Data Semantic databases may be the tools banks need to harness big data's potential,unknown,MILLER FREEMAN INC,2012
,61,Biobanking with Big Data: A Need for Developing “Big Data Metrics”,unknown,Mary Ann Leibert Inc.,2016
,62,"Busting the big data myths. A backlash against `big data' has led to questions about whether it is overrated, but Bright North's Rob Hick believes it does offer opportunities and provides pointers on how to make the most of them","Hick, R.",CENTAUR MEDIA PLC,2014
,63,Publicly Available Data and Pediatric Mental Health: Leveraging Big Data to Answer Big Questions for Children,"Blair, L. M.","Elsevier Science B.V., Amsterdam",2016
,64,"Little Teams, Big Data: Big Data Provides New Opportunities for Teams Theory",Dorothy R. Carter; Raquel Asencio; Amy Wax; Leslie A. DeChurch; Noshir S. Contractor,Blackwell Pub.,2015
,65,"Christine L. Borgman, Big Data, Little Data, No Data: Scholarship in the Networked World","Stevens,  Hallam",Johns Hopkins University Press,2016
,66,Getting real about Big Data: applying critical realism to analyse Big Data hype,"Fox, S.; Do, T.",EMERALD,2013
,67,U.S. Government BETS Big on Data: A multi-agency big data initiative offers an array of national advantages,"Seffers, G.I.",AFCEA ARMED FORCES COMMUNICATIONS AND,2013
,68,"The Politics of Big Data: Big Data, Big Brother?A.R.SætnanI.SchneiderN.Green (eds 2018LondonRoutledge 346 pp., £ 105 ISBN 987‐1‐138‐29374‐8","King, Tom",John Wiley & Sons Ltd,2019
,69,Towards building a data-intensive index for big data computing – A case study of Remote Sensing data processing,"Ma, Y.; Wang, L.; Liu, P.; Ranjan, R.","Elsevier Science B.V., Amsterdam.",2015
,70,The Case for Big Data: New York City's Kalvi HUMAN Project Aims to Use Big Data in Resolving Big Health Questions,"Mertz, L.",INSTITUTE OF ELECTRICAL AND ELECTRONICS ENGINEERS,2016
,71,"The Benefits of Big Data ``Big data'' can be challenging to acquire and use, but the rewards can boost business performance","Roberts, B.",SOCIETY FOR HUMAN RESOURCE MANAGEMENT,2013
,72,"The politics of big data. Big data, big brother?","Mager, Astrid",Taylor & Francis,2019
,73,"Convex Optimization for Big Data: Scalable, randomized, and parallel algorithms for big data analytics","Cevher, V.; Becker, S.; Schmidt, M.",INSTITUTE OF ELECTRICAL AND ELECTRONIC ENGINEERS,2014
,74,"The value of `big data' The use of ``big data'' provides the industry with an opportunity to improve energy efficiency, minimize environmental impact and optimize operational performance. How do we work as an industry to unlock its value?",unknown,SIMMONS-BOARDMAN PUBLISHING CORPORATION,2014
,75,Hybrid Optimization in Big Data: Error Detection and Data Repairing by Big Data Cleaning Using CSO-GSA,"Satish,  K. V. Rama; Kavya,  N. P.",Springer,2017
,76,"Exploratory vs solution-seeking big data: Discussion for ""Experiences with big data: Accounts from a data scientist's perspective""","M. Anderson-Cook, Christine",Taylor & Francis,2020
,77,Can Sensors Collect Big Data? An Energy-Efficient Big Data Gathering Algorithm for a WSN,"Rani, S.; Ahmed, S. H.; Talwar, R.; Malhotra, J.",IEEE,2017
,78,Guest Editorial: What’s so big about Big Data? Finding the spaces and perils of Big Data,"Burns, R.; Thatcher, J.",Springer Science + Business Media,2015
,79,"Political Science and Big Data: Structured Data, Unstructured Data, and How to Use Them","Grossman, Jonathan; Pedahzur, Ami",THE ACADEMY OF POLITICAL SCIENCE,2020
,80,Organizational performance and capabilities to analyze big data: do the ambidexterity and business value of big data analytics matter?,"Aljumah, Ahmad Ibrahim; Nuseir, Mohammed T.; Alam, Md. Mahmudul",Emerald Group Publishing Limited,2021
,81,"Control, use and ownership of big data: A reciprocal view of customer big data value in the hospitality and tourism industry","Line, Nathaniel D.; Dogru, Tarik; El-Manstrly, Dahlia; Buoye, Alex; Malthouse, Ed; Kandampully, Jay","Elsevier Science B.V., Amsterdam.",2020
,82,"SCHOOL CIO: WHO'S AFRAID OF BIG DATA?: Big data is overwhelming, but it can also furnish important information about individual students, schools, and districts","Rubenstein, S.","PETER LI, INC.",2014
,83,Oncology Reimbursement in the Era of Personalized Medicine and Big Data Little has been written about reimbursement in the era of big data-driven personalized medicine. The way the United States pays for the majority of its health care is a hindrance to the provision of personalized oncology care,"Ward, J.C.",AMERICAN SOCIETY OF CLINICAL ONCOLOGY,2014
,84,On the Analysis of Utility and Risk for Masked Data in Big Data: A Small Data Analysis,"Torra, Vicenç",IOS Press,2018
,85,Science as a Vocation in the Era of Big Data: the Philosophy of Science behind Big Data and humanity’s Continued Part in Science,"Sætra, H. S.",Springer Nature,2018
,86,Radiotherapy (RT) Patterns Of Practice Variability Identified As A Challenge To Real-World Big Data: Recommendations From The Learning From Analysis Of Multicenter Big Data Aggregation (LAMBDA) Consortium,"Caissie, A.L.; Mierzwa, M.L.; Fuller, C.D.; Rajaraman, M.; Lin, A.; McDonald, A.M.; Popple, R.A.; Xiao, Y.; van Dijk, L.; Balter, P.; Fong, H.; Ping, H.; Kovoor, M.; Lee, J.; Rao, A.; Martel, M.K.; Thompson, R.F.; Merz, B.; Yao, J.; Mayo, C.","Elsevier Science B.V., Amsterdam.",2020
,87,"The Anamorphic Stretch Transform: Putting the Squeeze on ``Big Data'' Coping with a deluge of digital information will require more efficient ways to capture, sample and store data. One new approach works by selectively ``warping'' the data to provide beiter resolution of the fine details- while still reducing total data size","Jalali, B.; Asghari, M.H.",OSA OPTICAL SOCIETY OF AMERICA,2014
,88,183: Head and Neck Radiotherapy (RT) Patterns of Practice Variability Identified as a Challenge to Real-World Big Data: Recommendations from the Learning from Analysis of Multicentre Big Data Aggregation (Lambda) Consortium,"Caissie, Amanda; Mierzwa, Michelle; Fuller, Clifton; Rajaraman, Murali; Lin, Alex; MacDonald, Andrew; Popple, Richard; Xiao, Ying; VanDijk, Lisanne; Balter, Peter; Fong, Helen; Ping, Heng; Lee, Joonsan; Rao, Arvind; Martel, Mary; Thompson, Reid; Yao, John","Elsevier Science B.V., Amsterdam.",2020
,89,The Aadhaar Effect: Why the World's Largest Identity Project Matters; Dissent on Aadhaar: Big Data Meets Big Brother; We Are Data: Algorithms and the Making of Our Digital Selves— Alarmingly Simplified Data Gathering,"Crishna, Vickram",ECONOMIC & POLITICAL WEEKLY,2020
,90,`Big data' reporting guidelines,"Perry, D.C.; Parsons, N.; Costa, M.L.",British Editorial Society of Bone & Joint Surgery,2014
,91,Big data–model integration and AI for vector‐borne disease prediction,"Peters, Debra P. C.; McVey, D. Scott; Elias, Emile H.; Pelzel‐McCluskey, Angela M.; Derner, Justin D.; Burruss, N. Dylan; Schrader, T. Scott; Yao, Jin; Pauszek, Steven J.; Lombard, Jason; Rodriguez, Luis L.",John Wiley & Sons Ltd,2020
,92,Data Privacy and Big Data-Compliance Issues and Considerations,"Yu, W.E.",Information Systems Audit and Control Association,2014
,93,Big Data's End Run Around Procedural Privacy Protections Recognizing the inherent limitations of consent and anonymity,"Barocas, S.; Nissenbaum, H.",ACM ASSOCIATION FOR COMPUTING MACHINERY,2014
,94,"Data Science, Predictive Analytics, and Big Data: A Revolution That Will Transform Supply Chain Design and Management","Waller, M. A.; Fawcett, S. E.",COUNCIL OF LOGISTICTS MANAGEMENT,2013
,95,Big data: a big opportunity for the petroleum and petrochemical industry,"Hassani, Hossein; Silva, Emmanuel Sirimal","John Wiley & Sons, Ltd",2018
,96,Data: Big and Small,"Jones-Schenk,  Jan",SLACK INCORPORATED,2017
,97,Big Data—Small Children: Adult Height in Preterm Infants Treated With GH,"Blethen, Sandra L",ENDOCRINE SOCIETY,2020
,98,“Big Data” In Alzheimer’s Disease Research: An Environmental Scan,"Hong, Y.; Pickering, M.; Perfetto, E.; Albrecht, J.; Ung, B.; Yang, K.; Lederer, H.","Elsevier Science B.V., Amsterdam",2015
,99,``Big Data'' and the CBC-diff,"Chaves,  Fernando",MEDICAL LABORATORY OBSERVER,2015
,100,"Big Data: State-of-the-art Concepts, Techniques, Technologies, Modeling Approaches and Research Challenges","Costa,  Carlos; Santos,  Maribel Yasmina","NEWSWOOD LTD.,",2017
,1,Big Data-Scoring unter dem Einfluss der Datenschutz-Grundverordnung,"Eschholz, S.",Springer Science + Business Media,2017
,2,"""big data"" in the information age","Gordo, Blanca","John Wiley & Sons, Ltd",2017
,3,'Big data' approaches for novel anti-cancer drug discovery,"Benstead-Hume, Graeme; Wooller, Sarah K.; Pearl, Frances M. G.",Informa Healthcare,2017
,4,Big Data: Gaining a Competitive Edge,"Worster, A.; Weirich, T. R.; Andera, F.","John Wiley & Sons, Ltd",2014
,5,Big Data: Its Meaning,"Reed, P.G.",unknown,2018
,6,"Big data's blueprint In the 1900s, America probed its citizens' lives as never before",unknown,IPC MAGAZINES LTD,2015
,7,Big Data—Go `Granular' to Boost Sales We look at how advances in technology are enhancing sales and marketing efforts by commercial launderers,unknown,TRSA,2019
,8,BIG DATA and Data-Driven Intelligent Predictive Algorithms to support creativity in Industrial Engineering,"Rousseaux, Francis","Elsevier Science B.V., Amsterdam.",2017
,9,Big Data-Not a Panacea,"Riffat, M.",Information Systems Audit and Control Association,2014
,10,Big data: a distributed storage and processing for online learning systems,"Dahdouh, Karim; Dakkak, Ahmed; Oughdir, Lahcen",Inderscience Enterprises,2019
,11,Big Data-What Is It and What Use Is It?,"Atkinson, G.",Lippincott Williams and Wilkins,2014
,12,Big data's role in expanding access to financial services in China,"Kshetri, Nir","Elsevier Science B.V., Amsterdam.",2016
,13,Big Data: A very short introduction,unknown,"Elsevier Science B.V., Amsterdam.",2017
,14,‘Big data’ or ‘big knowledge’? Brazilian genomics and the process of academic marketization,"Bicudo, Edison",CAMBRIDGE UNIVERSITY PRESS,2018
,15,Big Data: New Tricks for Econometrics,"Varian, H.R.",AMERICAN ECONOMIC ASSOC,2014
,16,Big Data: New Opportunities and New Challenges [Guest editors' introduction],"Michael, K.; Miller, K. W.",IEEE INSTITUTE OF ELECTRICAL AND ELECTRONICS,2013
,17,"Big Data: A Revolution That Will Transform How We Live, Work, and Think","Naimi, A. I.; Westreich, D. J.",Oxford University Press,2014
,18,Big Data-Based Optimization of a Pressure Swing Adsorption Unit for Syngas Purification: On Mapping Uncertainties from a Metaheuristic Technique,"Nogueira, Idelfonso B. R.; Martins, Márcio A. F.; Regufe, Maria João; Rodrigues, Alírio E.; Loureiro, José M.; Ribeiro, Ana M.",ACS AMERICAN CHEMICAL SOCIETY,2020
,19,Big data-informed energy efficiency assessment of China industry sectors based on K-means clustering,"Liu, Gengyuan; Yang, Jin; Hao, Yan; Zhang, Yan","Elsevier Science B.V., Amsterdam.",2018
,20,Big Data: Tutorial and guidelines on information and process fusion for analytics algorithms with MapReduce,"Ramírez-Gallego, Sergio; Fernández, Alberto; García, Salvador; Chen, Min; Herrera, Francisco","Elsevier Science B.V., Amsterdam.",2018
,21,"Data-intensive applications, challenges, techniques and technologies: A survey on Big Data","Philip Chen, C. L.; Zhang, C. Y.","Elsevier Science B.V., Amsterdam.",2014
,22,Big data-based prediction of terrorist attacks,"Meng, Xi; Nie, Lingyu; Song, Jiapeng","Elsevier Science B.V., Amsterdam.",2019
,23,"Big Data: History, Current Status, and Challenges Going Forward","Shi, Y.",NATIONAL ACADEMY OF ENGINEERING,2014
,24,Data Intelligence in the Context of Big Data: A Survey,"Hicham M. Safhi, Bouchra Frikh, Badr Hirchoua, Brahim Ouhbi, Ismail Khalil",Rinton Press,2017
,25,Big Data-Driven Abnormal Behavior Detection in Healthcare Based on Association Rules,"Zhou, Shengyao; He, Jie; Yang, Hui; Chen, Donghua; Zhang, Runtong",IEEE,2020
,26,Big Data: The Next Big Thing in Innovation,"Gobble, MaryAnne M.",INDUSTRIAL RESEARCH INSTITUTE INC,2013
,27,Big Data: An Institutional Perspective on Opportunities and Challenges,"Hasnat, Baban",Newfound Press,2018
,28,Big Data-enabled Customer Relationship Management: A holistic approach,"Zerbino, Pierluigi; Aloini, Davide; Dulmin, Riccardo; Mininno, Valeria","Elsevier Science B.V., Amsterdam.",2018
,29,"Big data's mistake Figures are fine, but war isn't a numbers game PLUS: This week's cultural picks",unknown,IPC MAGAZINES LTD,2018
,30,Big Data: A Quick-Start Guide for Learning Practitioners,"Dearborn, J.",A.ST.D,2014
,31,Big data! Big deal?,"Mackie, P.; Sim, F.; Johnman, C.","Elsevier Science B.V., Amsterdam",2015
,32,Big Data: Unleashing information,"Tien, J. M.",Springer Science + business Media,2013
,33,Big Data in E&amp;P: Real-Time Adaptive Analytics and Data-Flow Architecture,"Brule, M.R.","Red Hook, NY; Curran Associates, Inc.",2013
,34,Big data‐driven machine learning‐enabled traffic flow prediction,"Kong, Fanhui; Li, Jian; Jiang, Bin; Zhang, Tianyuan; Song, Houbing",John Wiley & Sons Ltd,2019
,35,Big Data: The Connected Car shines at Mobile World Congress (and elsewhere),unknown,CHILTON CO.,2014
,36,Big Data: Understanding how Creative Organisations Create and Sustain their Networks,"Bruce, Fraser; Malcolm, Jackie; O’Neill, Shaleph",Taylor & Francis,2017
,37,Big data: critical questions for sport and society,"Spaaij, Ramón; Thiel, Ansgar",Taylor & Francis,2017
,38,"""Big Data"" Analysis: Putting the Data Cart Before the Modelling Horse?","Barr, G. D.; Stewart, T. J.; Kantor, B. S.",John Wiley & Sons Ltd,2018
,39,"Big Data: What, Why, When and How","Kezunovic, M.","Stillwater, OK; Oklahoma State University",2014
,40,Big data: New tend to sustainable consumption research,"Wang, Zhaohua; Xue, Mengtian; Wang, Yutao; Song, Malin; Li, Shanjun; Daziano, Ricardo A.; Wang, Bo; Ma, Guanhua; Chen, Ke; Li, Xiangtao; Zhang, Bin","Elsevier Science B.V., Amsterdam.",2019
,41,Big Data's Big Unintended Consequences,"Wigan, M. R.; Clarke, R.",IEEE INSTITUTE OF ELECTRICAL AND ELECTRONICS,2013
,42,Big Data: Implications for Financial Managers,"Fanning, K.; Grant, R.","John Wiley & Sons, Ltd",2013
,43,Big Data: Progress or a Big Headache?,"Dhawan, A.; Brand, J.C.; Rossi, M.J.; Lubowitz, J.H.",unknown,2018
,44,``Big Data'' in the Intensive Care Unit: Closing the Data Loop,"Celi, L.A.; Mark, R.G.; Stone, D.J.; Montgomery, R.A.",American Thoracic Society; 1998,2013
,45,"Data as an asset: What the oil and gas sector can learn from other industries about ""Big Data""","Perrons, Robert K.; Jensen, Jesse W.","Elsevier Science B.V., Amsterdam.",2015
,46,Data-Driven Mary Hammon explains how to leverage the potential of big data-in Planning Practice,unknown,APA AMERICAN PLANNING ASSOCIATION,2015
,47,"Big Data: A Revolution That Will Transform How We Live, Work, and Think","John Walker, Saint",BLACKWELL PUBLISHERS,2014
,48,Data-driven stochastic robust optimization: General computational framework and algorithm leveraging machine learning for optimization under uncertainty in the big data era,"Ning, Chao; You, Fengqi","Elsevier Science B.V., Amsterdam.",2018
,49,"Big Data's promise: messy, like us","Karlgaard, R.",FORBES MAGAZINE,2013
,50,Big Data: A Primer,"Vinaja, Robert",IVY LEAGUE PUBLISHING,2017
,51,"Big Data: Opportunities, Challenges and Solutions","Gorodetsky, V.",Springer Science and Business Media,2014
,52,Data Envelopment Analysis and Big Data: Revisit with a Faster Method,"Khezrimotlagh, Dariush; Zhu, Joe",Kluwer Academic Publishers,2020
,53,Big data: Some statistical issues,"Cox, D.R.; Kartsonaki, Christiana; Keogh, Ruth H.","Elsevier Science B.V., Amsterdam.",2018
,54,Big Data: Incentivized Self,"Dobrow, L.",CPS COMMUNICATIONS INC,2013
,55,"Big Data-Based Approach to Detect, Locate, and Enhance the Stability of an Unplanned Microgrid Islanding","Jiang,  Huaiguang; Li,  Yan; Zhang,  Yingchen; Zhang,  Jun Jason; Gao,  David Wenzhong; Muljadi,  Eduard; Gu,  Yi",AMERICAN SOCIETY OF CIVIL ENGINEERS,2017
,56,"Big Data: A Revolution That Will Transform How We Live, Work, and Think","Dunham, Ian M.",Taylor and Francis,2015
,57,"Big Data: Was ist das? Und was bedeutet es für Wissenschaft, Wirtschaft und Gesellschaft?","Günther, O.",Springer Science + Business Media,2014
,58,Big Data—Based Estimation for Ship Safety Distance Distribution in Port Waters,"Zhang,  Liye; Wang,  Hua; Meng,  Qiang","Washington, DC; National Academy Press; 1998",2015
,59,``Big data'' needs an analysis of decision processes,"Analytis, P.P.; Moussaid, M.; Artinger, F.; Kammer, J.E.; Gigerenzer, G.",CAMBRIDGE UNIVERSITY PRESS,2014
,60,Big data: the next challenge for statistics,"Ieva, F.",Springer,2015
,61,Big data: ethical issues,"Alnaji, Loay A.; Eletter, Shorouq F.; Refae, Ghaleb A. El",Inderscience,2019
,62,Big data-based deterioration prediction models and infrastructure management: towards assetmetrics,"Kobayashi, Kiyoshi; Kaito, Kiyoyuki",Taylor & Francis,2017
,63,Big Ideas or Big Data? [President's Message],"Sayed, Ali H.",INSTITUTE OF ELECTRICAL AND ELECTRONIC ENGINEERS,2018
,64,Big Data: Warum Sie noch lange darauf warten sollten,"Springer, G. W.",Springer Science + Business Media,2014
,65,Big Data: Next-Generation Machines for Big Science,"Hack, James J.; Papka, Michael E.",IEEE,2015
,66,Big Data-Oriented Product Infant Failure Intelligent Root Cause Identification Using Associated Tree and Fuzzy DEA,unknown,IEEE,2019
,67,Big Data's Impact on Privacy for Librarians and Information Professionals,"Harper, L. M.; Oltmann, S. M.",John Wiley & Sons Ltd,2017
,68,BIG DATA: HOW TO TARGET YOUR CUSTOMER'S CUSTOMER,"Leininger, J.",Printing Industries of America,2014
,69,"""Big Data"" in Vascular Surgery: A Reality not to be Missed But to Use With Caution","Ricco, Jean-Baptiste; Guetarni, Farid; Gargiulo, Mauro","Elsevier Science B.V., Amsterdam",2019
,70,Big data: an information security context,"Constantine, C.","Elsevier Science B.V., Amsterdam.",2014
,71,"`Big Data' collaboration: Exploring, recording and sharing enterprise knowledge","Sukumar, S.R.; Ferrell, R.K.",IOS Press; 1999,2013
,72,Big Data: from collection to visualization,"Ghesmoune, M.; Azzag, H.; Benbernou, S.; Lebbah, M.; Duong, T.; Ouziri, M.",Springer Science + Business Media,2017
,73,Big Data: A Framework for Research,"Nagle, T.; Sammon, D.",IOS Press,2014
,74,Big Data-Driven Manufacturing-Process-Monitoring-for-Quality Philosophy,Jeffrey A. Abell; Debejyo Chakraborty; Carlos A. Escobar; Kee H. Im; Diana M. Wegner ; Michael A. Wincek,American Society of Mechanical Engineering (ASME),2017
,75,Data-Driven Decision Making in Precision Agriculture: The Rise of Big Data in Agricultural Systems,"Tantalaki, Nicoleta; Souravlas, Stavros; Roumeliotis, Manos",Taylor & Francis,2019
,76,Big Data: Herausforderungen und Potenziale für deutsche Softwareunternehmen,"Fischer, S.",Springer Science + Business Media,2014
,77,`Big Data': Here to Stay ... But What is it?,"Pang, L.",SOCIETY FOR COMPUTERS AND LAW,2014
,78,Big data: creating the right balance,"Palamuthusingam, Dharmenaan; Reyaldeen, Reza; Nath, Karthik","Elsevier Science B.V., Amsterdam",2019
,79,"Big data: a revolution that will transform how we live, work, and think","Armstrong, K.",Taylor & Francis,2014
,80,Big Data: Prospects and Challenges,"Moorthy,  Janakiraman; Lahiri,  Rangin; Biswas,  Neelanjan; Sanyal,  Dipyaman; Ranjan,  Jayanthi; Nanath,  Krishnadas; Ghosh,  Pulak",THE INDIAN INSTITUTE OF MANAGEMENT,2015
,81,Big data: A new opportunity for transport geography?,"Tranos, Emmanouil; Mack, Elizabeth","Elsevier Science B.V., Amsterdam.",2019
,82,"Big data: analyse that In the first of a series, Katharine Bagshaw FCA examines the scope and use of data analytics in audit",unknown,INSTITUTE OF CHARTERED ACCOUNTANTS,2017
,83,Big data: techniques and technologies in geoinformatics,"Tsou, Ming-Hsiang",Taylor & Francis,2014
,84,Big data-driven business model innovation by traditional industries in the Chinese economy,"Cheah, Sarah; Wang, Shenghui",EMERALD GROUP PUBLISHING LTD,2017
,85,Big Data: Transforming the Design Philosophy of Future Internet,"Yin, H.; Jiang, Y.; Lin, C.; Luo, Y.; Liu, Y.",IEEE INSTITUTE OF ELECTRICAL AND ELECTRONICS,2014
,86,-BIG DATA- IN RESEARCH ON SOCIAL POLICY,"Cook, T. D.","John Wiley & Sons, Ltd",2014
,87,Big data: balancing between risks and opportunities – UAE perspective,"Habbal, Firas","Inderscience Enterprises Ltd.,",2018
,88,Big Data: An incoming challenge for vehicular ad‐hoc networking,"Bourdy, Emilien; Piamrat, Kandaraj; Herbin, Michel",John Wiley & Sons Ltd,2019
,89,Big Data: the challenge for small research groups in the era of cancer genomics,"Noor, A. M.; Holmberg, L.; Gillett, C.; Grigoriadis, A.",Nature Publishing Group,2015
,90,``Big Data'' Has Not Come to Pediatric Anesthesia,"Fisher, D.M.",Lippincott Williams & Wilkins,2014
,91,"Big data: A revolution that will transform how we live, work, and think, by Viktor Mayer-Schonberger and Kenneth Cukier","Parise, Salvatore",Taylor & Francis,2016
,92,Big Data: A Normal Accident Waiting to Happen?,"Nunan, D.; Di Domenico, M.",Springer Science + Business Media,2017
,93,Big data: webcrawling and analysing financial news using RapidMiner,"Lane, Jesse; Kim, Hak J.",Inderscience,2015
,94,"Data warehousing and OLAP over Big Data: a survey of the state-of-the-art, open problems and future challenges","Cuzzocrea, Alfredo",Inderscience,2015
,95,Big data's big bias in drug safety,unknown,British Medical Association,2017
,96,Big Data: A Challenge for Social Sciences. Criticisms for Social Knowledge and Politics,"Affuso, Olimpia; Coco, Antonella",CEPSR LTD.,2019
,97,Big data: web-crawling and analysing financial news using RapidMiner,"Lane, Jesse; Kim, Hak J.",Inderscience,2015
,98,Big data: a new perspective for the establishment of segments for niche marketing,"Ojha, Satish Chandra",Inderscience,2019
,99,Big Data’s Promises and Perils,"OJALA, MARYDEE",Information Today,2015
,100,Big data: The panoptic medium of the information age.,"Biggs, Simon",Artlink,2017
,1,Data-driven innovation: switching the perspective on Big Data,"Trabucchi, Daniel; Buganza, Tommaso",Emerald Group Publishing Limited,2019
,2,Big Data? Qualitative Approaches to Digital Research,unknown,Emerald,2014
,3,"Big Data, Little Data: Scholarship in the Networked World","Calvert, Philip",Emerald Group Publishing Limited,2017
,4,"Big data: Dimensions, evolution, impacts, and challenges","Lee, In","Elsevier Science B.V., Amsterdam.",2017
,5,"`Big data' approaches to trauma outcome prediction and autonomous resuscitation Shiming Yang, Mary Njoku and Colin F Mackenzie discuss how massive clinical data are used in learning prediction models at level 1 trauma centres to support decision making in trauma patients",unknown,Mark Allen Publishing,2014
