Unnamed: 0,번호,제목,저자,출판사,출판일
,6,Big Data: Theoretical Aspects,"Haykin, S.; Wright, S.; Bengio, Y.",IEEE INSTITUTE OF ELECTRICAL AND ELECTRONICS,2016
,7,`Big data' in pharmaceutical science: challenges and opportunities,unknown,Future Science,2014
,8,Big Data and the Ownership in Data: Recent Developments in Europe,"Hoeren, T.",SWEET & MAXWELL/ESC PUBLISHING,2014
,9,'Big data' flood warning.,Editor(s),CONCORDE PUBLISHING LTD,2015
,10,Big data: the next frontier for innovation in therapeutics and healthcare,"Issa, N.T.; Byers, S.W.; Dakshanamurthy, S.",Informa Healthcare,2014
,11,Big Data: Is It Crunch Time for Pharma?,"Upton,  Julian",ASTER PUBLISHING CORPORATION,2017
,12,"‘Big data’, Hadoop and cloud computing in genomics","O’Driscoll, A.; Daugelaite, J.; Sleator, R. D.","Elsevier Science B.V., Amsterdam",2013
,13,"""Big Tigers, Big Data"": Learning Social Reactions to China's Anticorruption Campaign through Online Feedback","Zhu, Jiangnan; Huang, Huang; Zhang, Dong",Wiley-Blackwell,2019
,14,"Big Data: Techniques and Technologies in Geoinformatics, H.A. Karimi (editor). CRC Press, Taylor & Francis, London (2014). 312 pp., Price:  82. ISBN: 978-1-466-59651-2","Verbesselt, J.","Elsevier Science B. V., Amsterdam",2015
,15,"Big Universe, Big Data: Machine Learning and Image Analysis for Astronomy","Kremer, J.; Stensbo-Smidt, K.; Gieseke, F.; Pedersen, K. S.; Igel, C.",COMPUTER SOCIETY,2017
,16,Big Data's Big Handprint,"Harper,  Stephen; Sarni,  William",THE ENVIRONMENTAL LAW INSTITUTE,2017
,17,Big Data? Qualitative Approaches to Digital Research,unknown,Emerald,2014
,18,Big Data-Driven Cognitive Computing System for Optimization of Social Media Analytics,"Sangaiah, Arun Kumar; Goli, Alireza; Tirkolaee, Erfan Babaee; Ranjbar-Bourani, Mehdi; Pandey, Hari Mohan; Zhang, Weizhe",IEEE,2020
,19,BIG BUCKS ARE BACKING BIG DATA'S LOBBYING EFFORTS ON CAPITOL HILL,"Kaye, Kate","Crain Communications, Inc.",2013
,20,Big Data: Will It Improve Patient-Centered Care?,"Fiebig, D. G.",ADIS/Springer,2017
,21,Big data: why ignorance is no longer acceptable,"Toozs-Hobson, P.; Toozs-Hobson, N.; Kelley, T.",unknown,2018
,22,Big data: Where do I start?,"Ziehler, K.B.",MGMA,2014
,23,Big data: extending the business strategy toolbox,"Woerner, Stephanie L; Wixom, Barbara H.",Palgrave Macmillan,2015
,24,Big Data-Revolution oder Datenhybris?,"Gramelsberger, G.",SPRINGER SCIENCE + BUSINESS MEDIA,2017
,25,Big Data: Practical Applications,unknown,IEEE INSTITUTE OF ELECTRICAL AND ELECTRONICS,2016
,26,Big Data: Practical Applications [Scanning the Issue],"Benediktsson, Jon Atli",IEEE INSTITUTE OF ELECTRICAL AND ELECTRONICS,2016
,27,``Big Data'' Management and Security Application to Telemetry Data Products,"Kalibjian, J.","San Diego, Calif; International Foundation for Telemetering",2014
,28,Big Data: Theoretical Aspects [Scanning the Issue],unknown,IEEE INSTITUTE OF ELECTRICAL AND ELECTRONICS,2015
,29,Big–deep–smart data in imaging for guiding materials design,"Kalinin, S. V.; Sumpter, B. G.; Archibald, R. K.",Nature Publishing Group,2015
,30,``Big Data'' in Laboratory Medicine,"Tolan,  N. V.; Parnas,  M. L.; Baudhuin,  L. M.; Cervinski,  M. A.; Chan,  A. S.; Holmes,  D. T.; Horowitz,  G.; Klee,  E. W.; Kumar,  R. B.; Master,  S. R.",American Association for Clinical Chemistry; 1999,2015
,31,Big data: a new look at old problems,"Cenko, E.; Hall, M.; Bugiardini, R.",Oxford University Press,2016
,32,Big Data-Driven Marketing: How Machine Learning Outperforms Marketers' Gut-Feeling,"Sundsoy, P.; Bjelland, J.; Iqbal, A.M.; Pentland, A.; de Montjoye, Y.-A.",SPRINGER-VERLAG,2014
,33,Big data: Guest editorial,unknown,IEEE,2015
,34,Big Data-Driven Contextual Processing Methods for Electrical Capacitance Tomography,unknown,IEEE,2019
,35,Data-driven medicinal chemistry in the era of big data,"Lusher, S. J.; McGuire, R.; van Schaik, R. C.; Nicholson, C. D.; de Vlieg, J.","Elsevier Science B.V., Amsterdam.",2014
,36,Big Data: Opportunities and Challenges for English Corpus Linguistics,"Renouf, Antoinette",CRIST-JAN DOEDENS,2019
,37,Big Data: Issues for an International Political Sociology of Data Practices1,"Madsen, A. K.; Flyverbom, M.; Hilbert, M.; Ruppert, E.",Oxford University Press,2016
,38,Big Data: could it ever cure Alzheimer's disease?,"Husain, M.",Oxford University Press,2014
,39,"""Big Data"" Meets ""Smart Beta""",RICHARD C. DAVIS,Institutional Investor,2015
,40,Big Data: A case study of disruption and government power,"Galloway,  Kate",LEGAL SERVICE BULLETIN CO-OPERATIVE LTD,2017
,41,Big Data: The Paradigm Shift Needed to Revolutionize Musculoskeletal Clinical Research,"Helfet, D.L.; Hanson, B.P.; De Faoite, D.","EXCERPTA MEDICA, INC.",2014
,42,Big data-driven supply chain performance measurement system: a review and framework for implementation,"Kamble, Sachin S.; Gunasekaran, Angappa",Taylor & Francis,2020
,43,BIG DATA'S IMPACT ON TRADING AND TEcHNOLOGY,MARCUS KWAN,Institutional Investor,2014
,44,Big data: lessons for employers and employees,"Jeske, Debora; Calvard, Thomas",Emerald Group Publishing Limited,2020
,45,Big Data: New Opportunities for M&A,"Fanning, K.; Drogt, E.","John Wiley & Sons, Ltd",2014
,46,Data as an Asset: What the Upstream Oil & Gas Industry Can Learn About ``Big Data'' from Companies Like Social Media,"Perrons, R. K.; Jensen, J. W.",Society of Petroleum Engineers,2014
,47,"Big data: Finders keepers, losers weepers?","Sax, M.",Springer Science + Business Media,2016
,48,Data-Enabled Digestive Medicine: A New Big Data Analytics Platform,"Yan, Lu; Huang, Weihong; Wang, Liming; Feng, Song; Peng, Yonghong; Peng, Jie",IEEE,2021
,49,"-BIG DATA-, THE -INTERNET OF THINGS- AND THE -INTERNET OF SIGNS-","O'Leary, D. E.","John Wiley & Sons, Ltd",2013
,50,"Big Data: Manage it, don't drown in it The exponential growth of data is challenging our ability to process it effectively to exploit what it contains","Kwan, M.",ADAMS BUSINESS MEDIA,2012
,51,Big Data: Mining for meaning How data mining is bringing order to chaos,unknown,EOLAS,2011
,52,Big Data-Based Epidemiology of Uveitis and Related Intraocular Inflammation,"Akhter, Mashal; Toy, Brian",Lippincott Williams & Wilkins,2021
,53,Big Data: Present and Future,"Chauhan, Preeti; Sood, Mohit",IEEE INSTITUTE OF ELECTRICAL AND ELECTRONICS,2021
,54,Big Data: The New Information Challenge,"Arnold, S.E.",ONLINE INC,2011
,55,Big data-based identification of methylated genes associated with drug resistance and prognosis in ovarian cancer,"Yan, Bingbing; Xiong, Chunqiu; Huang, Feifeng; Zhang, Mingming; Mo, Yan; Bai, Hua",Lippincott Williams and Wilkins,2020
,56,Big Data…Small Conclusion,"Murthy, Sudish C.","Elsevier Science B.V., Amsterdam",2020
,57,“Big Data” Has Not Come to Pediatric Anesthesia,"Fisher, Dennis M.",Lippincott Williams & Wilkins,2014
,58,Big Data: A Game Changer for Environmental Management,"Qiu,  Xin; Met,  P.; Taylor,  Nigel",Air and Waste Management Association,2014
,59,Big Data-driven personal protective equipment stockpiling framework under Universal Healthcare for Disease Control and Prevention in the COVID-19 Era,"Ma, Kevin Sheng-Kai; Tsai, Shin-Yi","Elsevier Science B. V., Amsterdam",2020
,60,Data-Driven Authoritarianism: Non-democracies and Big Data,"Kabanov, Yury; Karyagin, Mikhail",Springer,2018
,61,Big Data? More Challenges!,"Qiu, Peihua",Taylor and Francis,2016
,62,'BIG DATA' AND ALEXANDER VON HUMBOLDT'S APPROACH TO SCIENCE,"Grana‐Behrens, Daniel","John Wiley & Sons, Ltd",2021
,63,Big data: Are large prospective randomized trials obsolete in the future?,"Hudis, Clifford A.","Elsevier Science B.V., Amsterdam",2015
,64,Big Questions for “Big Data”,"Wears, R. L.; Williams, D. J.","Elsevier Science B.V., Amsterdam",2016
,65,-Big data- from shrinking pathogen populations,"Neafsey, D. E.",Blackwell Publishing Ltd,2013
,66,Big Data: The Management Revolution,"McAfee, A.; Brynjolfsson, E.",HARVARD BUSINESS REVIEW,2012
,67,‘Big data’ for pedestrian volume: Exploring the use of Google Street View images for pedestrian counts,"Yin, Li; Cheng, Qimin; Wang, Zhenxin; Shao, Zhenfeng","Elsevier Science B.V., Amsterdam.",2015
,68,Big data: and the micropolitics of entanglement in the Earth's becoming,"Somerville, Margaret; Woods, Annette; Duhn, Iris; Rautio, Pauliina; Powell, Sarah; McConnell-Imbriotis, Alison; Galvez, Sarita",Taylor & Francis,2021
,69,„Big Data“ im Gesundheitsrecht – Ende der „Datensparsamkeit“?,"Ladeur, K. H.",Springer Science + Business Media,2016
,70,Big Data and Bad Data: On the Sensitivity of Security Policy to Imperfect Information,"Graves,  James T.; Acquisti,  Alessandro; Christin,  Nicolas",The University of Chicago Press,2016
,71,Big Data: Large-Scale Historical Infrastructure from the Minnesota Population Center,"Sobek, M.; Cleveland, L.; Flood, S.; Hall, P.K.; King, M.L.; Ruggles, S.; Schroeder, M.",HELDREF PUBLICATIONS,2011
,72,Big Data: Promises and Problems,"Gudivada, V. N.; Baeza-Yates, R.; Raghavan, V. V.",IEEE INSTITUTE OF ELECTRICAL AND ELECTRONICS,2015
,73,"Big Data: The good, the bad and the ugly","Gronemeyer, Hinrich; Souren, Nicole Y.","John Wiley & Sons, Ltd",2021
,74,Big Data. Experts discuss customer data treatment,"Cuddeford-Jones, M.",CENTAUR MEDIA PLC,2013
,75,Big Data: You Are Adding To ... and Using It,"Makela,  Carole J.",American Association of Family and Consumer Sciences; 1999,2016
,76,Data-driven ICU management: Using Big Data and algorithms to improve outcomes,"Carra, Giorgia; Salluh, Jorge I.F.; da Silva Ramos, Fernando José; Meyfroidt, Geert","Elsevier Science B. V., Amsterdam",2020
,77,Big data's dark side,unknown,Institution of Engineering and Technology,2016
,78,Big Data: Challenges and opportunities for clinical pharmacology,"Flockhart, D.; Bies, R. R.; Gastonguay, M. R.; Schwartz, S. L.",Wiley-Blackwell,2016
,79,Big data’s role in expanding access to financial services in China,"Kshetri, Nir","Elsevier Science B.V., Amsterdam.",2016
,80,Big data: applications in interventional radiology,"Gordon, R.; Kavali, P.; Liu, R.",ELSEVIER SCIENCE B.V. AMSTERDAM,2016
,81,"BIG DATA: NEW SCIENCE, NEW CHALLENGES, NEW DIALOGICAL OPPORTUNITIES","Fuller, M.",Wiley-Blackwell,2015
,82,"Big Data: As utilities seek to extract value from their technology assets, smart grid and metering data is becoming a gold mine for insights about how to improve service and save money","Danigelis, A.",PUBLIC UTILITIES REPORTS INC,2012
,83,Big Data: A Cheerleader for Translational Perioperative Medicine,"Ackland, Gareth L.; Stephens, Robert C. M.","Lippincott, Williams & Wilkins",2016
,84,Big Data: Goldmine or Minefield,"Jackson,  Joni R.",American Marketing Association,2016
,85,Big data-driven precision medicine: Starting the custom-made era of iatrology,"Song, Chang; Kong, Ying; Huang, Lianfang; Luo, Hui; Zhu, Xiao","Elsevier Science B.V., Amsterdam.",2020
,86,Big data: Little difference,"Morley, S.",Wiley-Blackwell,2015
,87,'Big data' in pharmaceutical science: challenges and opportunities,unknown,Future Science,2014
,88,Big Data: An Introduction for Librarians,"Hoy, Matthew B.",Taylor & Francis,2014
,89,Big data: the key to energy efficiency in smart buildings,"Moreno, M. V.; Dufour, L.; Skarmeta, A. F.; Jara, A. J.; Genoud, D.; Ladevie, B.; Bezian, J. J.",Springer Science + Business Media,2016
,90,Big Data—Hot Air or Hot Topic?,"Serrano,  Angel",Information Systems Audit and Control Association,2016
,91,Big data: Challenges and perspectives,"Duellmann, D.",IOS Press,2014
,92,Big data-driven strategic orientation in international marketing,"Akter, Shahriar; Hossain, Md Afnan; Lu, Qiang (Steven); Shams, S.M. Riad",Emerald Group Publishing Limited,2021
,93,Big Data—What Is It and What Use Is It?,"Atkinson, Graham",Lippincott Williams and Wilkins,2014
,94,Big Data: A Boon to Business Intelligence,"Ohata, M.; Kumar, A.",FINANCIAL EXECUTIVES INSTITUTE,2012
,95,Big Data: A Survey,"Chen, M.; Mao, S.; Liu, Y.",Springer Science + Business Media,2014
,96,`Big Data': A Whole Yotta Bytes,unknown,CONGRESSIONAL QUARTERLY INC,2012
,97,Data analysis in health and big data: A machine learning medical diagnosis model based on patients' complaints,"Silahtaroğlu, Gökhan; Yılmaztürk, Nevin",Taylor & Francis,2021
,98,`Big data' looks best in 3D,unknown,REED BUSINESS PUBLISHING,2013
,99,Big data: From beginning to future,"Yaqoob, Ibrar; Hashem, Ibrahim Abaker Targio; Gani, Abdullah; Mokhtar, Salimah; Ahmed, Ejaz; Anuar, Nor Badrul; Vasilakos, Athanasios V.","Elsevier Science B.V., Amsterdam.",2016
,100,Big Data's Disparate Impact,"Barocas,  Solon; Selbst,  Andrew D.",CALIFORNIA LAW REVIEW INC.,2016
,1,Big Data's Impact on the U.S. Medical Industry,"Makumbi,  Victoria",WARREN GORHAM & LAMONT INC,2017
,2,"""Big Data"" Dynamic Factor Models for Macroeconomic Measurement and Forecasting: A Discussion of the Papers by Lucrezia Reichlin and by Mark W. Watson","Diebold, F. X.",CAMBRIDGE UNIVERSITY PRESS,2003
,3,‘Big data’ in mental health research: current status and emerging possibilities,"Stewart, R.; Davis, K.",Springer Science + Business Media,2016
,4,'Big data' patentometrics for R&D decision-making,"Verma, Charu; Suri, Pradeep Kumar",Emerald Group Publishing Limited,2021
,5,Big data or small data? A methodological review of sustainable tourism,"Xu, Feifei; Nash, Nicholas; Whitmarsh, Lorraine",Taylor & Francis,2020
,6,Big Data from Sparse Data: Diverse Scientific Benchmarks Reveal Optimization Imperatives for Implicit Membrane Energy Functions,"Alford, Rebecca F.; Gray, Jeffrey J.","Elsevier Science B.V., Amsterdam",2020
,7,Big Data-Based Driving Pattern Clustering and Evaluation in Combination with Driving Circumstances,"Si, Lulu; Hirz, Mario; Brunner, Helmut",Society of Automotive Engineers,2018
,8,Big Data-Driven Service Composition Using Parallel Clustered Particle Swarm Optimization in Mobile Environment,"Hossain, M. S.; Moniruzzaman, M.; Muhammad, G.; Ghoneim, A.; Alamri, A.",Institute of Electrical & Electronics Engineers,2016
,9,"Big data: the elements of good questions, open data, and powerful software","Ho, Joshua W. K.; Giannoulatou, Eleni",SPRINGER,2019
,10,Big Data: Issues and Challenges Moving Forward,"Kaisler, S.; Armour, F.; Espinosa, J.A.; Money, W.",IEEE,2013
,11,"Big data: techniques and technologies in geoinformatics, edited by Hassan A. Karimi, Boca Raton, FL, CRC Press, 2014, 312 pp., US$129.95 (hardcover), ISBN 13-978-1466586512","Nara, Atsushi",Taylor & Francis,2015
,12,Big Data: A Big Opportunity for Librarians,"Gordon-Murnane, L.",ONLINE INC,2012
,13,Big data-based multimedia transcoding method and its application in multimedia data mining-based smart transportation and telemedicine,"Zhu, D.",Springer Science + Business Media,2016
,14,Big Data. Big Problem?,"Harrop, Clare; Dallman, Aaron R.; Boyd, Brian A.",John Wiley,2021
,15,Big data or small data? A methodological review of sustainable tourism,"Xu, Feifei; Nash, Nicholas; Whitmarsh, Lorraine",Taylor & Francis,2020
,16,Big Buildings and Big Data: Do Energy Disclosure Policies Impact Energy Use over Time?,"Papadopoulos,  Sokratis; Kontokosta,  Constantine E.",ASCE,2017
,17,Big data trends in stroke epidemiology in the United States: But are they good data?,"Prabhakaran,  S.",American Academy of Neurology,2017
,18,Big data trends in stroke epidemiology in the United States: But are they good data?,"Prabhakaran,  S.",American Academy of Neurology,2018
,19,NZIM: Big data: Management's new big gun,"Birchfield, R.",Mediaweb Ltd,2013
,20,Coping with ``Big Data'' Growing Pains,"Strenger, L.",The Data Warehouse Institute,2008
,21,Is ''Big Data'' creepy?,"Cumbley, R.; Church, P.","Elsevier Science B.V., Amsterdam.",2013
,22,D2D Big Data: Content Deliveries over Wireless Device-to-Device Sharing in Large-Scale Mobile Networks,"Wang, X.; Zhang, Y.; Leung, V. C.; Guizani, N.; Jiang, T.",IEEE,2018
,23,From big data to rich data: The key features of athlete wheelchair mobility performance,"van der Slikke, R. M.; Berger, M. A.; Bregman, D. J.; Veeger, H. E.","Elsevier Science B.V., Amsterdam.",2016
,24,Harnessing Big Data: Capabilities that Deliver Results,unknown,CAHNERS,2015
,25,Taming Big Data: Implementation of a Clinical Use-Case Driven Architecture,"Mayo, C.; Kessler, M. L.; Feng, M.; Weyburn, G.; El Naqa, I.; Eisbruch, A.; Matuszak, M. M.; McShan, D.; Moran, J. M.; Anderson, C. J.","Elsevier Science B.V., Amsterdam.",2016
,26,"COVID-19, Big Data: how it will change the way we practice Medicine ","Pasipoularides, A",Oxford University Press,2021
,27,Handling big data: research challenges and future directions,"Anagnostopoulos, I.; Zeadally, S.; Exposito, E.",Springer Science + Business Media,2016
,28,Maximum Data-Resolution Efficiency for Fog-Computing Supported Spatial Big Data Processing in Disaster Scenarios,unknown,"THE IEEE, INC.",2019
,29,Harnessing Big Data: A Methodological Approach to Linking Electronic Health Records with Patient-Reported Survey Data,"Liebert, R; Lee, LK; Jaffe, DH; Doane, MJ; Haskell, T","Elsevier Science B.V., Amsterdam",2018
,30,"Finance Big Data: Management, Analysis, and Applications","Sun, Yunchuan; Shi, Yufeng; Zhang, Zhengjun",ME Sharpe,2019
,31,"A 'big data' approach to global freshwater mussel diversity (Bivalvia: Unionoida), with an updated checklist of genera and species","Graf, Daniel L; Cummings, Kevin S",Oxford University Press,2021
,32,FROM BIG DATA TO SMART DATA: THE ROLE OF METABOLOMICS IN GENERATING ACTIONABLE KNOWLEDGE IN ALZHEIMER'S DISEASE FOR PERSONALIZED TREATMENT,"Geerts, Hugo",ELSEVIER SCIENCE B.V. AMSTERDAM,2017
,33,Rethinking `big data' as visual knowledge: the sublime and the diagrammatic in data visualisation,"McCosker, A.; Wilken, R.",Taylor & Francis,2014
,34,Assessing Whether “Big Data” Solutions Provide Value For Diagnostics Manufacturers,"Hertz, D.; Gavaghan, M.; Garfield, S.","Elsevier Science B.V., Amsterdam",2014
,35,"HANDLING `BIG DATA' FROM VIDEO STREAMS Professor Plamen Angelov, Chair in Intelligent Systems at Lancaster University and Director of EntelSenSys, discusses patented new technology for predicting and updating the position of targets in video streams",unknown,unknown,2014
,36,"Policing, crime and ‘big data’; towards a critique of the moral economy of stochastic governance","Sanders, C. B.; Sheptycki, J.",Springer Science + Business Media,2017
,37,"Digitisation, 'Big Data' and the transformation of accounting information","Bhimani, Alnoor; Willcocks, Leslie",Taylor & Francis,2014
,38,"Humanizing Big Data: Marketing at the Meeting of Data, Social Science and Consumer InsightC.Strong, 2015London, Kogan Page224 pp., £19.99 ISBN 978‐0‐749‐47211‐5","Dietz, Sebastian",John Wiley & Sons Ltd,2018
,39,Analyzing Big Data: Social Choice and Measurement,"Patty, J.W.; Penn, E.M.",American Political Science Association,2015
,40,Clouding Big Data: Information Privacy Considerations,"Gathegi, J.N.",Springer Science and Business Media,2014
,41,Using “Big Data” to Dissect Clinical Heterogeneity,"Altman, Russ B.; Ashley, Euan A.",American Heart Foundation; Lippincott Williams and Wilkins,2015
,42,With ``Big Data'' Comes Big Responsibility: Outreach to North Carolina Medicaid Patients With 10 or More Computed Tomography Scans in 12 Months,"Biola, H.; Best, R.M.; Lahlou, R.M.; Burke, L.M.B.; Dewar, C.; Jackson, C.T.; Broder, J.; Grey, L.; Semelka, R.C.; Dobson, A.",NORTH CAROLINA MEDICAL SOCIETY,2014
,43,"Digitisation, ‘Big Data’ and the transformation of accounting information","Bhimani, Alnoor; Willcocks, Leslie",Taylor & Francis,2014
,44,Novel Big Data-supported dynamic toll charging system: Impact assessment on Portugal's shadow-toll highways,"Figueiras, Paulo; Gonçalves, Diogo; Costa, Ruben; Guerreiro, Guilherme; Georgakis, Panos; Jardim-Gonçalves, Ricardo","Elsevier Science B.V., Amsterdam.",2019
,45,A Data-Driven Decision Making with Big Data Analysis on DNS Log,"Jung,  Euihyun",Springer,2017
,46,Utilizing ``Big Data'' Modeling for Evaluating Potential Jurors,unknown,Connexion International Media,2014
,47,Using data-driven safety decision-making to realize smart safety management in the era of big data: A theoretical perspective on basic questions and their answers,"Wang, Bing; Wu, Chao; Huang, Lang; Kang, Liangguo","Elsevier Science B.V., Amsterdam.",2019
,48,Aviation community is just beginning to understand what can be done with aircraft `big data',unknown,MCGRAW-HILL DATA SERVICES,2015
,49,Teaching 'big data' analysis to young immunologists,"Schultze, J. L.",Nature Publishing Group,2015
,50,"Integrating ""big data"" into aquatic ecology: challenges and opportunities",unknown,John Wiley & Co Ltd,2017
,51,Online big data-driven oil consumption forecasting with Google trends,"Yu, Lean; Zhao, Yaqing; Tang, Ling; Yang, Zebin","Elsevier Science B.V., Amsterdam.",2019
,52,"Digitisation, `Big Data' and the transformation of accounting information","Bhimani, A.; Willcocks, L.",Taylor & Francis,2014
,53,"Humanizing Big Data: Marketing at the Meeting of Data, Social Science and Consumer Insight C. Strong, 2015 London, Kogan Page 224 pp., 19.99 ISBN 978-0-749-47211-5","Dietz, S.",John Wiley & Sons Ltd,2018
,54,"Does 'Big Data' exist in medicinal chemistry, and if so, how can it be harnessed?","Tetko, Igor V; Engkvist, Ola; Chen, Hongming",Future Science,2016
,55,How `Big Data' Is Different,"Davenport, T.H.; Barth, P.; Bean, R.",SLOAN MANAGEMENT REVIEW ASSOCIATION,2012
,56,Social big data: Recent achievements and new challenges,"Bello-Orgaz, G.; Jung, J. J.; Camacho, D.","Elsevier Science B.V., Amsterdam.",2016
,57,Beyond big data: Social media challenges and opportunities for understanding social perception of energy,"Li, Ruopu; Crowe, Jessica; Leifer, David; Zou, Lei; Schoof, Justin",Elsevier Science B.V. Amsterdam,2019
,58,How ‘big data’ can make big impact: Findings from a systematic review and a longitudinal case study,"Fosso Wamba, S.; Akter, S.; Edwards, A.; Chopin, G.; Gnanzou, D.","Elsevier Science B.V., Amsterdam.",2015
,59,Integrating “big data” into surgical practice,"Mathias, Brittany; Lipori, Gigi; Moldawer, Lyle L.; Efron, Philip A.","Elsevier Science B.V., Amsterdam",2016
,60,A big data-driven dynamic estimation model of relief supplies demand in urban flood disaster,"Lin, Anqi; Wu, Hao; Liang, Guanghua; Cardenas-Tristan, Abraham; Wu, Xia; Zhao, Chong; Li, Dan","Elsevier Science B.V., Amsterdam",2020
,61,Demystifying Big Data: mandatory evolution for forensic accounting in Brazil,"Lima, Rafael Sousa; Serrano, André Luiz Marques; Cupertino, César Medeiros; Souza, Audrey Jones De; Ferreira, Lucas Oliveira Gomes",Inderscience,2020
,62,"Beyond Big Data: Surveillance, Metadata and Technology-Enabled Intelligence Opportunities in Counter-Terrorism","Wells,  David",IOS Press.,2016
,63,Prescription Data in Australia: How Useful is this ‘Big' Data?,"Kim, H.; Calcino, L.; Calcino, G.","Elsevier Science B.V., Amsterdam",2016
,64,NEUROPATHOLOGY BIG DATA: IT'S ALL VCID,"Kapasi, Alifiya; Schneider, Julie A.",ELSEVIER SCIENCE B.V. AMSTERDAM,2019
,65,"Biomedical Big Data: New Models of Control Over Access, Use and Governance","Vayena, E.; Blasimme, A.",Springer Science + Business Media,2017
,66,Manufacturing Data: Big changes on the factory floor,"Dejesus, E. X.",MCGRAW-HILL DATA SERVICES,1995
,67,The big data-business strategy interconnection: a grand challenge for knowledge management. A review and future perspectives,"Ciampi, Francesco; Marzi, Giacomo; Demi, Stefano; Faraoni, Monica",Emerald Group Publishing limited,2020
,68,Bridging data-capacity gap in big data storage,"Bhat, Wasim Ahmad","Elsevier Science B.V., Amsterdam.",2018
,69,Wireless big data: transforming heterogeneous networks to smart networks,"Huang, Y.; Tan, J.; Liang, Y. C.",Springer Science + Business Media,2017
,70,"Leveraging ""big data"" in respiratory medicine – data science, causal inference, and precision medicine","Raita, Yoshihiko; Camargo, Carlos A.; Liang, Liming; Hasegawa, Kohei",Informa Healthcare,2021
,71,Exploring Big Data: The Next Big Thing in Innovation,unknown,INDUSTRIAL RESEARCH INSTITUTE INC,2013
,72,Taming big data: Applying the experimental method to naturalistic data sets,Eyal Sagi,PSYCHONOMIC SOCIETY PUBLICATIONS,2019
,73,VIEWPOINT Big data: Your secret weapon,unknown,AMERICAN INST OF AERONAUTICS AND ASTRONAUTICS,2014
,74,Beyond Big Data?,"Cushing, J. B.",IEEE,2013
,75,The -Big Data- challenge: amplify your content using video and maximise your impact,"Murphy, D. G.; Everaerts, W.; Loeb, S.",Blackwell Publishing Ltd,2014
,76,A data-driven approach for discovery of the latest research trends in higher education for business by leveraging advanced technology and big data,"Park, Young-Eun",Taylor & Francis,2021
,77,RETHINK Big: European Roadmap for Hardware and Networking Optimizations for Big Data,"Alioto,  Gina; Carpenter,  Paul; Cristal,  Adrián; Unsal,  Osman; Leich,  Marcus; Avare,  Christophe",IEEE Computer Society,2017
,78,IoT-Based Big Data: From Smart City towards Next Generation Super City Planning,"Rathore,  M. Mazhar; Paul,  Anand; Ahmad,  Awais; Jeon,  Gwanggil",IDEA GROUP PUBLISHING,2017
,79,"A 'big data' approach to global freshwater mussel diversity (Bivalvia: Unionoida), with an updated checklist of genera and species","Graf, Daniel L; Cummings, Kevin S",Oxford University Press,2021
,80,Rethinking ‘big data’ as visual knowledge: the sublime and the diagrammatic in data visualisation,"McCosker, Anthony; Wilken, Rowan",Taylor & Francis,2014
,81,"Integrating ""big data"" into surgical practice","Mathias, Brittany; Lipori, Gigi; Moldawer, Lyle L.; Efron, Philip A.","Elsevier Science B.V., Amsterdam",2016
